Session ID,Caller Name,Caller Phone,Date,Time,Turn #,Role,Message,Timestamp
20260321_112307,Unknown,Unknown,2026-03-21,11:23:07,1,CALLER,I know.,11:23:10
20260321_112307,Unknown,Unknown,2026-03-21,11:23:07,2,AI,"Hi! Thanks for calling BluQQ, this is Priya. How can",11:23:11
20260321_112307,Unknown,Unknown,2026-03-21,11:23:07,3,AI,"Oh, I’m sorry if there’s any issue with the audio. Can you hear me",11:23:19
20260321_112307,Unknown,Unknown,2026-03-21,11:23:07,4,CALLER,તુષ્ટુ સ્યોનુ રૂગુ સ્યોમ્મ્.,11:23:23
20260321_112307,Unknown,Unknown,2026-03-21,11:23:07,5,CALLER,वर्ट अधर इसे परवाई गरता,11:23:30
20260321_112307,Unknown,Unknown,2026-03-21,11:23:07,6,AI,"Sure! We build trading bots, dashboards, data pipelines,",11:23:30
20260321_112307,Unknown,Unknown,2026-03-21,11:23:07,7,CALLER,MBC 뉴스 이덕영입니다.,11:23:37
20260321_112307,Unknown,Unknown,2026-03-21,11:23:07,8,AI,and we also work on AI tools and web scraping.,11:23:37
